{
  "acceptance_test": {
    "metric": "group_property_win_fraction",
    "operator": "gte",
    "threshold": 0.6666666666666666,
    "unit": "fraction"
  },
  "available_models": [
    {
      "artifact_hash": "sha256:27dbc19f3fa710bbb58b6f5e64e0fde5a6941edcb538f92d228b2d90e93f8890",
      "model_id": "chgnet",
      "version": "chgnet 0.4.2"
    },
    {
      "artifact_hash": "sha256:c69cbc43286d05a8e9974412a4fb5f4e28405f92ac15287537263475dfc3c694",
      "model_id": "mace-mp-small",
      "version": "mace-torch 0.3.16 / small"
    },
    {
      "artifact_hash": "sha256:1d80b5c4898b2d22d73dc82b17e1cabe1111d9cd6be4c2a7403dea6fa0ac83f3",
      "model_id": "mace-mp-medium",
      "version": "mace-torch 0.3.16 / medium"
    },
    {
      "artifact_hash": "sha256:59b5d1db18664525ad20358fe381b7ba71bdb260c8a3d6bbfe5fb5201e3be0d9",
      "model_id": "mace-mpa-0-medium",
      "version": "mace-torch 0.3.16 / mpa-0 medium"
    }
  ],
  "campaign_id": "correction.round-4.available-models.v1",
  "content_hash": "sha256:a285aeda1b0b3be9aec6ab1004d1f5e02df73d822a804cf59f13be6067a04250",
  "demotion_conditions": [
    {
      "action": "demote",
      "condition_id": "demote.round4.group-property-win-fraction",
      "metric": "group_property_win_fraction",
      "operator": "lt",
      "threshold": 0.6666666666666666,
      "unit": "fraction"
    }
  ],
  "evidence_requirements": [
    {
      "artifact_type": "model-measurements",
      "description": "All 32 registered model/material cells with immutable cloud receipts and no imputation.",
      "minimum_count": 32,
      "requirement_id": "e.round4.model-material-cells"
    }
  ],
  "exclusions": [
    {
      "disposition": "excluded",
      "rationale": "Preregistered excluded_unavailable: no reproducible gated UMA checkpoint was available at lock time.",
      "subject": "uma-family"
    }
  ],
  "execution": {
    "candidate_panel": {
      "path": "data/candidates/round4_targets.lock.json",
      "sha256": "sha256:b7562637c860b15b92f64659f0b063bc6d2b6c0c12899e21f370359cccb914f1"
    },
    "excluded_models_block_execution": false,
    "lane": "round4.available-models",
    "model_selection": "available_models"
  },
  "frozen_hypotheses": [
    {
      "frozen": true,
      "hypothesis_id": "h.round4.theorem-capped-same-class",
      "statement": "The theorem-capped v2 correction wins on at least two thirds of evaluable properties in each registered class under the frozen criterion."
    }
  ],
  "kill_conditions": [
    {
      "action": "kill",
      "condition_id": "kill.round4.theorem-consistency",
      "metric": "licensed_in_hull_worsened_cells",
      "operator": "gt",
      "threshold": 0,
      "unit": "count"
    }
  ],
  "preregistration": {
    "frozen_before_execution": true,
    "registered_at": "2026-07-14T00:00:00Z",
    "source": "docs/plans/2026-07-14-round4-preregistration.md"
  },
  "preregistration_id": "prereg.correction.round-4.2026-07-14",
  "target_premises": [
    {
      "claim_id": "correction.same_class.a0.v1",
      "premise_id": "round3_same_class_a0"
    }
  ],
  "version": 1
}
